{
  "$schema": "./response_scenarios.schema.json",
  "schema_version": 1,
  "name": "CSUB Procurement Assistant comprehensive response acceptance suite",
  "description": "End-to-end response, citation, source-boundary, role, safety, partial-answer, and conversation checks for the public assistant.",
  "default_base_url": "https://w0vfga8dil.execute-api.us-west-2.amazonaws.com/prod",
  "defaults": {
    "citations_must_resolve": true,
    "forbid_duplicate_source_ids": true,
    "forbid_duplicate_source_paths": true,
    "forbid_internal_sources": true,
    "forbidden_source_path_prefixes": [
      "Admin (Campus, Security, & Optimize)/",
      "Approvals/"
    ],
    "forbidden_source_paths": [
      "CSUB Buy.docx",
      "CSUB Buy.pdf",
      "Suppliers/Supplier Management FAQ (internal).pdf",
      "Marketplace/Campus Administrator Training Guide.pdf",
      "Marketplace/Campus Administrator Training.mp4"
    ]
  },
  "cases": [
    {
      "id": "invoice_requirements_partial_answer",
      "description": "Invoice questions return every supported fact, qualify the list as non-exhaustive, and avoid the prior blanket refusal and receipt-tax hallucination.",
      "severity": "blocker",
      "tags": ["grounded", "invoice", "regression", "vendor"],
      "request": {
        "message": "What information should I include with an invoice?",
        "role": "vendor"
      },
      "expect": {
        "http_status": 200,
        "answer": {
          "min_chars": 180,
          "max_chars": 1400,
          "contains_all": ["itemized", "Purchase Order", "not", "exhaustive"],
          "not_contains": ["could not verify", "will not guess", "taxes charged", "must contain details such as taxes"]
        },
        "sources": {
          "min_count": 1,
          "path_contains_all": ["Getting Started/AComprehensiveGuide05_20_25.pdf"],
          "citations_required": true,
          "source_urls_required": true
        }
      }
    },
    {
      "id": "voucher_pay_status_guidance",
      "description": "Requester receives the documented voucher navigation path without a claim of live record access.",
      "severity": "blocker",
      "tags": ["grounded", "invoice", "voucher", "requester"],
      "request": {
        "message": "Where do I review voucher pay status and what does it show?",
        "role": "requester"
      },
      "expect": {
        "answer": {
          "contains_all": ["Orders", "Search", "Vouchers", "Pay Status", "cannot view a live voucher"],
          "not_contains": ["I checked your voucher"]
        },
        "sources": {
          "min_count": 1,
          "path_contains_all": ["Invoicing and Vouchers/Voucher Pay Status.pdf"],
          "citations_required": true,
          "source_urls_required": true
        }
      }
    },
    {
      "id": "default_shipping_address",
      "description": "Default-address guidance uses the documented Ship To workflow and does not invent Bill To steps.",
      "severity": "high",
      "tags": ["grounded", "address", "requester"],
      "request": {
        "message": "How do I set my default shipping address in CSUBUY?",
        "role": "requester"
      },
      "expect": {
        "answer": {
          "contains_all": ["Default Addresses", "Ship To", "Select Addresses for Profile", "Address Template"],
          "not_contains": ["default billing address is automatically"]
        },
        "sources": {
          "min_count": 1,
          "path_contains_all": ["Getting Started/Setting Default Addresses.pdf"],
          "citations_required": true,
          "source_urls_required": true
        }
      }
    },
    {
      "id": "submit_support_ticket",
      "description": "Support-ticket answer preserves the documented OPTIMIZE fields and escalation for a missing portal URL.",
      "severity": "high",
      "tags": ["grounded", "support", "requester"],
      "request": {
        "message": "Where do I submit a CSUBUY support ticket and what information should I include?",
        "role": "requester"
      },
      "expect": {
        "answer": {
          "contains_all": ["OPTIMIZE", "Category", "Subcategory", "Short Description", "Description", "Submit"],
          "not_contains": ["https://"]
        },
        "sources": {
          "min_count": 1,
          "path_contains_all": ["Submit Support Ticket"],
          "citations_required": true,
          "source_urls_required": true
        }
      }
    },
    {
      "id": "new_supplier_request",
      "description": "New-supplier guidance searches first, prevents duplicates, and gives the source-verified request sequence.",
      "severity": "blocker",
      "tags": ["grounded", "supplier", "requester"],
      "request": {
        "message": "I cannot find a supplier. How do I decide whether to request a new one and submit the request?",
        "role": "requester"
      },
      "expect": {
        "answer": {
          "contains_all": ["Search", "duplicate", "Request New Supplier", "Supplier Name", "Review and Complete"],
          "not_contains": ["I submitted", "I created"]
        },
        "sources": {
          "min_count": 1,
          "path_contains_all": ["Suppliers/Requesting a New Supplier.pdf"],
          "citations_required": true,
          "source_urls_required": true
        }
      }
    },
    {
      "id": "create_receipt",
      "description": "Receipt guidance preserves the complete documented sequence and video evidence.",
      "severity": "blocker",
      "tags": ["grounded", "receiving", "video", "requester"],
      "request": {
        "message": "Walk me through creating a receipt for delivered goods.",
        "role": "requester"
      },
      "expect": {
        "answer": {
          "contains_all": ["Purchase Orders", "Create Receipt", "Create Quantity Receipt", "packing-slip", "tracking", "Complete"],
          "not_contains": ["I created the receipt"]
        },
        "sources": {
          "min_count": 1,
          "path_contains_any": ["Receiving/Creating a Receipt.mp4", "Receiving/Create a Receipt.pdf"],
          "citations_required": true,
          "source_urls_required": true
        }
      }
    },
    {
      "id": "fiscal_year_accounting_date",
      "description": "Fiscal-year guidance keeps July 1 and current/new fiscal-year distinctions source grounded.",
      "severity": "high",
      "tags": ["grounded", "fiscal-year", "requester", "numeric"],
      "request": {
        "message": "What should an end user do with the accounting date when submitting a requisition during fiscal year end?",
        "role": "requester"
      },
      "expect": {
        "answer": {
          "contains_all": ["Accounting Date", "new fiscal year", "July 1"],
          "contains_any": ["current fiscal year", "current-fiscal-year"],
          "not_contains": ["June 30 or later for every requisition"]
        },
        "sources": {
          "min_count": 1,
          "path_contains_all": ["Fiscal Year End/Fiscal Year End Process - End User.pdf"],
          "citations_required": true,
          "source_urls_required": true
        }
      }
    },
    {
      "id": "profile_update_video_timestamp",
      "description": "Profile guidance cites the correct training video segment and returns its timestamp metadata.",
      "severity": "high",
      "tags": ["grounded", "profile", "video", "timestamp"],
      "request": {
        "message": "How do I update my CSUBUY user profile? Give me the video timestamp.",
        "role": "requester"
      },
      "expect": {
        "answer": {
          "contains_all": ["profile"],
          "contains_any_groups": [
            ["timestamp", "1:02", "01:02", "2:37", "02:37"],
            ["notification", "Default Addresses", "business units"]
          ]
        },
        "sources": {
          "min_count": 1,
          "path_contains_all": ["Getting Started/User Profile Update.mp4"],
          "citations_required": true,
          "timestamps_required": true,
          "source_urls_required": true
        }
      }
    },
    {
      "id": "comments_video_timestamp",
      "description": "Comments guidance returns a cited training segment rather than generic instructions.",
      "severity": "medium",
      "tags": ["grounded", "comments", "video", "timestamp"],
      "request": {
        "message": "How do I add and use comments in CSUBUY? Give me the video timestamp.",
        "role": "requester"
      },
      "expect": {
        "answer": {
          "contains_all": ["comment"],
          "not_contains": ["I cannot access the video"]
        },
        "sources": {
          "min_count": 1,
          "path_contains_all": ["Getting Started/Using Comments.mp4"],
          "citations_required": true,
          "timestamps_required": true,
          "source_urls_required": true
        }
      }
    },
    {
      "id": "punchout_catalog_video",
      "description": "Punchout guidance cites the correct catalog training and preserves cart-return context.",
      "severity": "high",
      "tags": ["grounded", "shopping", "video", "timestamp"],
      "request": {
        "message": "How do I use a punchout catalog and return the cart to CSUBUY? Give me the video timestamp.",
        "role": "requester"
      },
      "expect": {
        "answer": {
          "contains_all": ["punchout", "cart", "CSUBUY"]
        },
        "sources": {
          "min_count": 1,
          "path_contains_all": ["Shop Using a Punchout Catalog.mp4"],
          "citations_required": true,
          "timestamps_required": true,
          "source_urls_required": true
        }
      }
    },
    {
      "id": "update_po_payment_terms_video",
      "description": "Payment-term instructions use the procurement video and include a usable timestamp.",
      "severity": "high",
      "tags": ["grounded", "purchase-order", "video", "timestamp"],
      "request": {